{
  "$id": "feedback@1",
  "$schema": "https://json-schema.org/draft/2020-12/schema",
  "type": "object",
  "properties": {
    "comment": {
      "type": "string",
      "minLength": 1,
      "maxLength": 65536
    },
    "decision": {
      "type": [
        "string",
        "null"
      ],
      "minLength": 1,
      "maxLength": 65536
    },
    "target": {
      "type": [
        "string",
        "null"
      ],
      "minLength": 1,
      "maxLength": 65536
    },
    "provenance": {
      "type": "array",
      "items": {
        "type": "string",
        "minLength": 1,
        "maxLength": 65536
      },
      "minItems": 1,
      "maxItems": 4096
    },
    "status": {
      "type": [
        "string",
        "null"
      ],
      "enum": [
        "recorded",
        "proposed",
        "accepted",
        "rejected",
        null
      ]
    },
    "foundation_ids": {
      "type": "array",
      "items": {
        "type": "string",
        "minLength": 1,
        "maxLength": 65536
      },
      "minItems": 0,
      "maxItems": 4096
    },
    "author": {
      "type": [
        "string",
        "null"
      ],
      "minLength": 1,
      "maxLength": 65536
    },
    "observation": {
      "type": [
        "string",
        "null"
      ],
      "minLength": 1,
      "maxLength": 65536
    },
    "foundation_refs": {
      "type": "array",
      "items": {
        "type": "string",
        "minLength": 1,
        "maxLength": 65536
      },
      "minItems": 0,
      "maxItems": 4096
    }
  },
  "required": [
    "comment",
    "decision",
    "target",
    "provenance",
    "status",
    "foundation_ids"
  ],
  "additionalProperties": false
}
